GENE_NAME,ID,DESCRIPTION,SUMMARY
SPRY4,81848,sprouty RTK signaling antagonist 4,"This gene encodes a member of a family of cysteine- and proline-rich proteins. The encoded protein is an inhibitor of the receptor-transduced mitogen-activated protein kinase (MAPK) signaling pathway. Activity of this protein impairs the formation of active GTP-RAS. Nucleotide variation in this gene has been associated with hypogonadotropic hypogonadism 17 with or without anosmia. Alternative splicing results in a multiple transcript variants. [provided by RefSeq, Jun 2014]"
SKAP1,8631,src kinase associated phosphoprotein 1,"This gene encodes a T cell adaptor protein, a class of intracellular molecules with modular domains capable of recruiting additional proteins but that exhibit no intrinsic enzymatic activity. The encoded protein contains a unique N-terminal region followed by a PH domain and C-terminal SH3 domain. Along with the adhesion and degranulation-promoting adaptor protein, the encoded protein plays a critical role in inside-out signaling by coupling T-cell antigen receptor stimulation to the activation of integrins. [provided by RefSeq, Jul 2008]"
ST4,6484,"ST3 beta-galactoside alpha-2,3-sialyltransferase 4","This gene encodes a member of the glycosyltransferase 29 family, a group of enzymes involved in protein glycosylation. The encoded protein is targeted to Golgi membranes but may be proteolytically processed and secreted. The gene product may also be involved in the increased expression of sialyl Lewis X antigen seen in inflammatory responses. Multiple transcript variants encoding different isoforms have been found for this gene. [provided by RefSeq, Dec 2011]"
PCDHB11,56125,protocadherin beta 11,"This gene is a member of the protocadherin beta gene cluster, one of three related gene clusters tandemly linked on chromosome five. The gene clusters demonstrate an unusual genomic organization similar to that of B-cell and T-cell receptor gene clusters. The beta cluster contains 16 genes and 3 pseudogenes, each encoding 6 extracellular cadherin domains and a cytoplasmic tail that deviates from others in the cadherin superfamily. The extracellular domains interact in a homophilic manner to specify differential cell-cell connections. Unlike the alpha and gamma clusters, the transcripts from these genes are made up of only one large exon, not sharing common 3' exons as expected. These neural cadherin-like cell adhesion proteins are integral plasma membrane proteins. Their specific functions are unknown but they most likely play a critical role in the establishment and function of specific cell-cell neural connections. [provided by RefSeq, Jul 2008]"
TTBK1,84630,tau tubulin kinase 1,"Summary:This gene belongs to the casein kinase 1 superfamily. The encoded protein is a neuron-specific, serine/threonine and tyrosine kinase, which regulates phosphorylation of tau, a protein that associates with microtubule assemblies and stabilizes them. Genetic variants in this gene are associated with Alzheimer's disease. [provided by RefSeq, Jul 2016]"
ZNF695,57116,zinc finger protein 695,"Predicted to enable DNA-binding transcription factor activity, RNA polymerase II-specific and RNA polymerase II cis-regulatory region sequence-specific DNA binding activity. Predicted to be involved in regulation of transcription, DNA-templated. Predicted to be located in nucleus. [provided by Alliance of Genome Resources, Apr 2022]"
PCDHB6,56130,protocadherin beta 6,"This gene is a member of the protocadherin beta gene cluster, one of three related gene clusters tandemly linked on chromosome five. The gene clusters demonstrate an unusual genomic organization similar to that of B-cell and T-cell receptor gene clusters. Unlike the alpha and gamma clusters, the transcripts from these genes do not share common 3' exons. These neural cadherin-like cell adhesion proteins are integral plasma membrane proteins that most likely play a critical role in the establishment and function of specific cell-cell neural connections. Alternative splicing results in multiple transcript variants. [provided by RefSeq, Dec 2014]"
SLC10A5,347051,solute carrier family 10 member 5,"Predicted to enable bile acid:sodium symporter activity. Predicted to be involved in bile acid and bile salt transport. Predicted to be integral component of membrane. [provided by Alliance of Genome Resources, Apr 2022]"
ANGPT1,284,angiopoietin 1,"This gene encodes a secreted glycoprotein that belongs to the angiopoietin family. Members of this family play important roles in vascular development and angiogenesis. All angiopoietins bind with similar affinity to an endothelial cell-specific tyrosine-protein kinase receptor. The protein encoded by this gene is a secreted glycoprotein that activates the receptor by inducing its tyrosine phosphorylation. It plays a critical role in mediating reciprocal interactions between the endothelium and surrounding matrix and mesenchyme and inhibits endothelial permeability. The protein also contributes to blood vessel maturation and stability, and may be involved in early development of the heart. Mutations in this gene are associated with hereditary angioedema. [provided by RefSeq, Aug 2020]"
JAM3,83700,junctional adhesion molecule 3,"Tight junctions represent one mode of cell-to-cell adhesion in epithelial or endothelial cell sheets, forming continuous seals around cells and serving as a physical barrier to prevent solutes and water from passing freely through the paracellular space. The protein encoded by this immunoglobulin superfamily gene member is localized in the tight junctions between high endothelial cells. Unlike other proteins in this family, the this protein is unable to adhere to leukocyte cell lines and only forms weak homotypic interactions. The encoded protein is a member of the junctional adhesion molecule protein family and acts as a receptor for another member of this family. A mutation in an intron of this gene is associated with hemorrhagic destruction of the brain, subependymal calcification, and congenital cataracts. Alternative splicing results in multiple transcript variants.[provided by RefSeq, Apr 2011]"
LINC00896,150197,long intergenic non-protein coding RNA 896,
ZNF214,7761,zinc finger protein 214,"This gene is expressed predominantly in the testis and encodes a zinc finger protein that contains an N-terminal kruppel-associated box A (KRABA) domain and twelve zinc finger domains. This gene is located within one of three regions on chromosome 11p15 associated with Beckwith-Wiedemann syndrome, called Beckwith-Wiedemann syndrome chromosome region-2 (BWSCR2), and is thought to play a role in the etiology of this disease. [provided by RefSeq, Aug 2017]"
PCDHB19P,84054,protocadherin beta 19 pseudogene,
RAMP2-AS1,100190938,RAMP2 antisense RNA 1,
WIPI1,55062,"WD repeat domain, phosphoinositide interacting 1","This gene encodes a WD40 repeat protein. Members of the WD40 repeat family are key components of many essential biologic functions. They regulate the assembly of multiprotein complexes by presenting a beta-propeller platform for simultaneous and reversible protein-protein interactions. Members of the WIPI subfamily of WD40 repeat proteins have a 7-bladed propeller structure and contain a conserved motif for interaction with phospholipids. Alternative splicing results in multiple transcript variants. [provided by RefSeq, Mar 2016]"
ZNF391,346157,zinc finger protein 391,"Predicted to enable DNA-binding transcription repressor activity, RNA polymerase II-specific and RNA polymerase II transcription regulatory region sequence-specific DNA binding activity. Predicted to be involved in negative regulation of transcription by RNA polymerase II. Predicted to be located in nucleus. [provided by Alliance of Genome Resources, Apr 2022]"
SV2A,9900,synaptic vesicle glycoprotein 2A,"The protein encoded by this gene is one of three related synaptic vesicle proteins. The encoded protein may interact with synaptotagmin to enhance low frequency neurotransmission in quiescent neurons. [provided by RefSeq, Jun 2016]"
SLC38A1,81539,solute carrier family 38 member 1,"Amino acid transporters play essential roles in the uptake of nutrients, production of energy, chemical metabolism, detoxification, and neurotransmitter cycling. SLC38A1 is an important transporter of glutamine, an intermediate in the detoxification of ammonia and the production of urea. Glutamine serves as a precursor for the synaptic transmitter, glutamate (Gu et al., 2001 [PubMed 11325958]).[supplied by OMIM, Mar 2008]"
FREM2,341640,FRAS1 related extracellular matrix 2,"This gene encodes an integral membrane protein containing numerous CSPG (chondroitin sulfate proteoglycan element) repeats and Calx-beta domains. The encoded protein localizes to the basement membrane, forming a ternary complex that plays a role in epidermal-dermal interactions. This protein is important for the integrity of skin and renal epithelia. Mutations in this gene are associated with Fraser syndrome. [provided by RefSeq, Apr 2014]"
CNTN4,152330,contactin 4,"This gene encodes a member of the contactin family of immunoglobulins. Contactins are axon-associated cell adhesion molecules that function in neuronal network formation and plasticity. The encoded protein is a glycosylphosphatidylinositol-anchored neuronal membrane protein that may play a role in the formation of axon connections in the developing nervous system. Deletion or mutation of this gene may play a role in 3p deletion syndrome and autism spectrum disorders. Alternative splicing results in multiple transcript variants. [provided by RefSeq, May 2011]"
GPLD1,2822,glycosylphosphatidylinositol specific phospholipase D1,"Many proteins are tethered to the extracellular face of eukaryotic plasma membranes by a glycosylphosphatidylinositol (GPI) anchor. The GPI-anchor is a glycolipid found on many blood cells. The protein encoded by this gene is a GPI degrading enzyme. Glycosylphosphatidylinositol specific phospholipase D1 hydrolyzes the inositol phosphate linkage in proteins anchored by phosphatidylinositol glycans, thereby releasing the attached protein from the plasma membrane. [provided by RefSeq, Jul 2008]"
JPH1,56704,junctophilin 1,"Junctional complexes between the plasma membrane and endoplasmic/sarcoplasmic reticulum are a common feature of all excitable cell types and mediate cross talk between cell surface and intracellular ion channels. The protein encoded by this gene is a component of junctional complexes and is composed of a C-terminal hydrophobic segment spanning the endoplasmic/sarcoplasmic reticulum membrane and a remaining cytoplasmic domain that shows specific affinity for the plasma membrane. This gene is a member of the junctophilin gene family. [provided by RefSeq, Jul 2008]"
SLC8A1,6546,solute carrier family 8 member A1,"In cardiac myocytes, Ca(2+) concentrations alternate between high levels during contraction and low levels during relaxation. The increase in Ca(2+) concentration during contraction is primarily due to release of Ca(2+) from intracellular stores. However, some Ca(2+) also enters the cell through the sarcolemma (plasma membrane). During relaxation, Ca(2+) is sequestered within the intracellular stores. To prevent overloading of intracellular stores, the Ca(2+) that entered across the sarcolemma must be extruded from the cell. The Na(+)-Ca(2+) exchanger is the primary mechanism by which the Ca(2+) is extruded from the cell during relaxation. In the heart, the exchanger may play a key role in digitalis action. The exchanger is the dominant mechanism in returning the cardiac myocyte to its resting state following excitation.[supplied by OMIM, Apr 2004]"
NLRC4,58484,NLR family CARD domain containing 4,"This gene encodes a member of the caspase recruitment domain-containing NLR family. Family members play essential roles in innate immune response to a wide range of pathogenic organisms, tissue damage and other cellular stresses. Mutations in this gene result in autoinflammation with infantile enterocolitis. Alternative splicing results in multiple transcript variants. [provided by RefSeq, Oct 2014]"
GALNT5,11227,polypeptide N-acetylgalactosaminyltransferase 5,"The protein encoded by this gene is a membrane-bound polypeptide N-acetylgalactosaminyltransferase that is found in the Golgi. The encoded protein catalyzes the first step in the mucin-type O-glycosylation of Golgi proteins, transfering an N-acetyl-D-galactosamine residue to a serine or threonine residue on the protein receptor. [provided by RefSeq, Aug 2016]"
GPR156,165829,G protein-coupled receptor 156,"G protein-coupled receptors (GPCRs) are a large superfamily of cell surface receptors characterized by 7 helical transmembrane domains, together with N-terminal extracellular and C-terminal intracellular domains.[supplied by OMIM, Mar 2008]"
WNT3,7473,Wnt family member 3,"The WNT gene family consists of structurally related genes which encode secreted signaling proteins. These proteins have been implicated in oncogenesis and in several developmental processes, including regulation of cell fate and patterning during embryogenesis. This gene is a member of the WNT gene family. It encodes a protein which shows 98% amino acid identity to mouse Wnt3 protein, and 84% to human WNT3A protein, another WNT gene product. The mouse studies show the requirement of Wnt3 in primary axis formation in the mouse. Studies of the gene expression suggest that this gene may play a key role in some cases of human breast, rectal, lung, and gastric cancer through activation of the WNT-beta-catenin-TCF signaling pathway. This gene is clustered with WNT15, another family member, in the chromosome 17q21 region. [provided by RefSeq, Jul 2008]"
SLC24A4,123041,solute carrier family 24 member 4,"Enables calcium, potassium:sodium antiporter activity. Involved in calcium ion transmembrane transport; potassium ion transmembrane transport; and sodium ion transmembrane transport. Acts upstream of or within cellular calcium ion homeostasis. Part of plasma membrane. Implicated in amelogenesis imperfecta hypomaturation type 2A5. [provided by Alliance of Genome Resources, Apr 2022]"
RBMS3,27303,RNA binding motif single stranded interacting protein 3,"This gene encodes an RNA-binding protein that belongs to the c-myc gene single-strand binding protein family. These proteins are characterized by the presence of two sets of ribonucleoprotein consensus sequence (RNP-CS) that contain conserved motifs, RNP1 and RNP2, originally described in RNA binding proteins, and required for DNA binding. These proteins have been implicated in such diverse functions as DNA replication, gene transcription, cell cycle progression and apoptosis. The encoded protein was isolated by virtue of its binding to an upstream element of the alpha2(I) collagen promoter. The observation that this protein localizes mostly in the cytoplasm suggests that it may be involved in a cytoplasmic function such as controlling RNA metabolism, rather than transcription. Multiple alternatively spliced transcript variants encoding different isoforms have been found for this gene. [provided by RefSeq, Apr 2010]"
SPATA17,128153,spermatogenesis associated 17,"Predicted to enable calmodulin binding activity. Predicted to be located in cytoplasm. [provided by Alliance of Genome Resources, Apr 2022]"
TPTE2P6,374491,TPTE2 pseudogene 6,
FHL1,3075,complement factor H,"This gene is a member of the Regulator of Complement Activation (RCA) gene cluster and encodes a protein with twenty short consensus repeat (SCR) domains. This protein is secreted into the bloodstream and has an essential role in the regulation of complement activation, restricting this innate defense mechanism to microbial infections. Mutations in this gene have been associated with hemolytic-uremic syndrome (HUS) and chronic hypocomplementemic nephropathy. Alternate transcriptional splice variants, encoding different isoforms, have been characterized. [provided by RefSeq, Oct 2011]"
PTGDR,5729,prostaglandin D2 receptor,"This gene encodes a member of the guanine nucleotide-binding protein (G protein)-coupled receptor (GPCR) superfamily. The receptors are seven-pass transmembrane proteins that respond to extracellular cues and activate intracellular signal transduction pathways. This protein is reported to be a receptor for prostaglandin D2, which is a mediator of allergic inflammation and allergic airway inflammation in asthma. Alternative splicing results in multiple transcript variants. [provided by RefSeq, Jul 2013]"
PWAR5,8123,Prader Willi/Angelman region RNA 5,
C2orf66,401027,chromosome 2 open reading frame 66,"Predicted to be located in extracellular region. [provided by Alliance of Genome Resources, Apr 2022]"
CHRM3,1131,cholinergic receptor muscarinic 3,"The muscarinic cholinergic receptors belong to a larger family of G protein-coupled receptors. The functional diversity of these receptors is defined by the binding of acetylcholine and includes cellular responses such as adenylate cyclase inhibition, phosphoinositide degeneration, and potassium channel mediation. Muscarinic receptors influence many effects of acetylcholine in the central and peripheral nervous system. The muscarinic cholinergic receptor 3 controls smooth muscle contraction and its stimulation causes secretion of glandular tissue. Alternative promoter use and alternative splicing results in multiple transcript variants that have different tissue specificities. [provided by RefSeq, Dec 2016]"
B3GALT1,8708,"beta-1,3-galactosyltransferase 1","This gene is a member of the beta-1,3-galactosyltransferase (beta3GalT) gene family. This family encodes type II membrane-bound glycoproteins with diverse enzymatic functions using different donor substrates (UDP-galactose and UDP-N-acetylglucosamine) and different acceptor sugars (N-acetylglucosamine, galactose, N-acetylgalactosamine). The beta3GalT genes are distantly related to the Drosophila Brainiac gene and have the protein coding sequence contained in a single exon. The beta3GalT proteins also contain conserved sequences not found in the beta4GalT or alpha3GalT proteins. The carbohydrate chains synthesized by these enzymes are designated as type 1, whereas beta4GalT enzymes synthesize type 2 carbohydrate chains. The ratio of type 1:type 2 chains changes during embryogenesis. By sequence similarity, the beta3GalT genes fall into at least two groups: beta3GalT4 and 4 other beta3GalT genes (beta3GalT1-3, beta3GalT5). This gene is expressed exclusively in the brain. The encoded protein shows strict donor substrate specificity for UDP-galactose. [provided by RefSeq, Jul 2008]"
SHROOM3,57619,shroom family member 3,"This gene encodes a PDZ-domain-containing protein that belongs to a family of Shroom-related proteins. This protein may be involved in regulating cell shape in certain tissues. A similar protein in mice is required for proper neurulation. [provided by RefSeq, Jan 2011]"
SLC26A10,65012,"solute carrier family 26 member 10, pseudogene","Predicted to enable anion transmembrane transporter activity. Predicted to be involved in anion transport. Predicted to be active in basolateral plasma membrane. Predicted to be integral component of plasma membrane. [provided by Alliance of Genome Resources, Apr 2022]"
SRSF12,135295,serine and arginine rich splicing factor 12,"Enables RNA binding activity. Involved in mRNA 5'-splice site recognition and regulation of alternative mRNA splicing, via spliceosome. Predicted to be located in nucleoplasm. Predicted to be active in cytoplasm and nuclear speck. [provided by Alliance of Genome Resources, Apr 2022]"
HOXA6,3203,homeobox A6,"In vertebrates, the genes encoding the class of transcription factors called homeobox genes are found in clusters named A, B, C, and D on four separate chromosomes. Expression of these proteins is spatially and temporally regulated during embryonic development. This gene is part of the A cluster on chromosome 7 and encodes a DNA-binding transcription factor which may regulate gene expression, morphogenesis, and differentiation. [provided by RefSeq, Jul 2008]"
PLCE1,51196,phospholipase C epsilon 1,"This gene encodes a phospholipase enzyme that catalyzes the hydrolysis of phosphatidylinositol-4,5-bisphosphate to generate two second messengers: inositol 1,4,5-triphosphate (IP3) and diacylglycerol (DAG). These second messengers subsequently regulate various processes affecting cell growth, differentiation, and gene expression. This enzyme is regulated by small monomeric GTPases of the Ras and Rho families and by heterotrimeric G proteins. In addition to its phospholipase C catalytic activity, this enzyme has an N-terminal domain with guanine nucleotide exchange (GEF) activity. Mutations in this gene cause early-onset nephrotic syndrome; characterized by proteinuria, edema, and diffuse mesangial sclerosis or focal and segmental glomerulosclerosis. Alternative splicing results in multiple transcript variants encoding distinct isoforms.[provided by RefSeq, Sep 2009]"
FSCN1,6624,fascin actin-bundling protein 1,"This gene encodes a member of the fascin family of actin-binding proteins. Fascin proteins organize F-actin into parallel bundles, and are required for the formation of actin-based cellular protrusions. The encoded protein plays a critical role in cell migration, motility, adhesion and cellular interactions. Expression of this gene is known to be regulated by several microRNAs, and overexpression of this gene may play a role in the metastasis of multiple types of cancer by increasing cell motility. Expression of this gene is also a marker for Reed-Sternberg cells in Hodgkin's lymphoma. A pseudogene of this gene is located on the long arm of chromosome 15. [provided by RefSeq, Sep 2011]"
PLAG1,5324,PLAG1 zinc finger,"Pleomorphic adenoma gene 1 encodes a zinc finger protein with 2 putative nuclear localization signals. PLAG1, which is developmentally regulated, has been shown to be consistently rearranged in pleomorphic adenomas of the salivary glands. PLAG1 is activated by the reciprocal chromosomal translocations involving 8q12 in a subset of salivary gland pleomorphic adenomas. Three transcript variants encoding two different isoforms have been found for this gene. [provided by RefSeq, Jul 2008]"
PABPC4L,132430,poly(A) binding protein cytoplasmic 4 like,"Predicted to enable mRNA 3'-UTR binding activity; poly(A) binding activity; and poly(U) RNA binding activity. Predicted to be part of ribonucleoprotein complex. Predicted to be active in cytoplasmic stress granule; cytosol; and nucleus. [provided by Alliance of Genome Resources, Apr 2022]"
ZNF96P1,221584,zinc finger and SCAN domain containing 12 pseudogene 1,
NANOS3,342977,nanos C2HC-type zinc finger 3,"Predicted to enable mRNA binding activity. Involved in germ cell development; negative regulation of translation; and positive regulation of nuclear-transcribed mRNA catabolic process, deadenylation-dependent decay. Located in nucleus and perinuclear region of cytoplasm. [provided by Alliance of Genome Resources, Apr 2022]"
CD200R1,131450,CD200 receptor 1,"This gene encodes a receptor for the OX-2 membrane glycoprotein. Both the receptor and substrate are cell surface glycoproteins containing two immunoglobulin-like domains. This receptor is restricted to the surfaces of myeloid lineage cells and the receptor-substrate interaction may function as a myeloid downregulatory signal. Mouse studies of a related gene suggest that this interaction may control myeloid function in a tissue-specific manner. Alternative splicing of this gene results in multiple transcript variants. [provided by RefSeq, Jul 2008]"
DPY19L2P4,442523,DPY19L2 pseudogene 4,
IL15,3600,interleukin 15,"The protein encoded by this gene is a cytokine that regulates T and natural killer cell activation and proliferation. This cytokine and interleukine 2 share many biological activities. They are found to bind common hematopoietin receptor subunits, and may compete for the same receptor, and thus negatively regulate each other's activity. The number of CD8+ memory cells is shown to be controlled by a balance between this cytokine and IL2. This cytokine induces the activation of JAK kinases, as well as the phosphorylation and activation of transcription activators STAT3, STAT5, and STAT6. Studies of the mouse counterpart suggested that this cytokine may increase the expression of apoptosis inhibitor BCL2L1/BCL-x(L), possibly through the transcription activation activity of STAT6, and thus prevent apoptosis. Alternatively spliced transcript variants of this gene have been reported. [provided by RefSeq, Feb 2011]"
RAPGEF4,11069,Rap guanine nucleotide exchange factor 4,"Enables guanyl-nucleotide exchange factor activity. Predicted to be involved in regulation of neurotransmitter receptor localization to postsynaptic specialization membrane and regulation of postsynapse organization. Predicted to act upstream of or within adenylate cyclase-activating G protein-coupled receptor signaling pathway; regulation of exocytosis; and secretion by cell. Predicted to be located in plasma membrane. Predicted to be active in glutamatergic synapse; hippocampal mossy fiber to CA3 synapse; and postsynaptic density. Implicated in autistic disorder. [provided by Alliance of Genome Resources, Apr 2022]"
PP3501,126321,major facilitator superfamily domain containing 12,"Enables cysteine transmembrane transporter activity. Involved in cysteine transmembrane transport; pigment metabolic process involved in pigmentation; and regulation of melanin biosynthetic process. Located in lysosome and melanosome. Part of late endosome. [provided by Alliance of Genome Resources, Apr 2022]"
