GENE_NAME,ID,DESCRIPTION,SUMMARY
MIR4697HG,22997,immunoglobulin superfamily member 9B,"Predicted to enable kinase binding activity. Predicted to be involved in synaptic membrane adhesion. Predicted to act upstream of or within homophilic cell adhesion via plasma membrane adhesion molecules and positive regulation of inhibitory postsynaptic potential. Predicted to be located in dendrite; inhibitory synapse; and neuronal cell body. Predicted to be active in GABA-ergic synapse; neuron projection; and postsynaptic specialization of symmetric synapse. [provided by Alliance of Genome Resources, Apr 2022]"
FREM2,341640,FRAS1 related extracellular matrix 2,"This gene encodes an integral membrane protein containing numerous CSPG (chondroitin sulfate proteoglycan element) repeats and Calx-beta domains. The encoded protein localizes to the basement membrane, forming a ternary complex that plays a role in epidermal-dermal interactions. This protein is important for the integrity of skin and renal epithelia. Mutations in this gene are associated with Fraser syndrome. [provided by RefSeq, Apr 2014]"
FLRT3,23767,fibronectin leucine rich transmembrane protein 3,"This gene encodes a member of the fibronectin leucine rich transmembrane protein (FLRT) family. FLRTs may function in cell adhesion and/or receptor signalling. Their protein structures resemble small leucine-rich proteoglycans found in the extracellular matrix. This gene is expressed in many tissues. Two alternatively spliced transcript variants encoding the same protein have been described for this gene. [provided by RefSeq, Jul 2010]"
RAB3B,5865,"RAB3B, member RAS oncogene family","Enables GDP binding activity; GTPase activity; and myosin V binding activity. Involved in several processes, including positive regulation of dopamine uptake involved in synaptic transmission; regulation of synaptic vesicle cycle; and regulation of vesicle size. Located in perinuclear region of cytoplasm and vesicle. Is active in dopaminergic synapse. Is anchored component of synaptic vesicle membrane. [provided by Alliance of Genome Resources, Apr 2022]"
SERPINA3,12,serpin family A member 3,"The protein encoded by this gene is a member of the serpin family of proteins, a group of proteins that inhibit serine proteases. This gene is one in a cluster of serpin genes located on the q arm of chromosome 14. Polymorphisms in this protein appear to be tissue specific and influence protease targeting. Variations in this protein's sequence have been implicated in Alzheimer's disease, and deficiency of this protein has been associated with liver disease. Mutations have been identified in patients with Parkinson disease and chronic obstructive pulmonary disease. [provided by RefSeq, Jun 2020]"
DFNB42,286676,immunoglobulin like domain containing receptor 1,"This gene encodes a protein that contains an immunoglobulin-like domain. The encoded protein may function as a multimeric receptor at the cell surface. The expression of this gene may be a diagnostic marker for cancer progression. Alternatively spliced transcript variants encoding multiple protein isoforms have been observed for this gene. [provided by RefSeq, Dec 2010]"
SCUBE3,222663,"signal peptide, CUB domain and EGF like domain containing 3","This gene encodes a member of the signal peptide, complement subcomponents C1r/C1s, Uegf, bone morphogenetic protein-1 and epidermal growth factor-like domain containing protein family. Overexpression of this gene in human embryonic kidney cells results in secretion of a glycosylated form of the protein that forms oligomers and tethers to the cell surface. This gene is upregulated in lung cancer tumor tissue compared to healthy tissue and is associated with loss of the epithelial marker E-cadherin and with increased expression of vimentin, a mesenchymal marker. In addition, the protein encoded by this gene is a transforming growth factor beta receptor ligand, and when secreted by cancer cells, it can be cleaved in vitro to release the N-terminal epidermal growth factor-like repeat domain and the C-terminal complement subcomponents C1r/C1s domain. Both the full length protein and C-terminal fragment can bind to the transforming growth factor beta type II receptor to promote the epithelial-mesenchymal transition and tumor angiogenesis. Alternative splicing results in multiple transcript variants. [provided by RefSeq, Dec 2014]"
RASGRF1,5923,Ras protein specific guanine nucleotide releasing factor 1,"The protein encoded by this gene is a guanine nucleotide exchange factor (GEF) similar to the Saccharomyces cerevisiae CDC25 gene product. Functional analysis has demonstrated that this protein stimulates the dissociation of GDP from RAS protein. The studies of the similar gene in mouse suggested that the Ras-GEF activity of this protein in brain can be activated by Ca2+ influx, muscarinic receptors, and G protein beta-gamma subunit. Mouse studies also indicated that the Ras-GEF signaling pathway mediated by this protein may be important for long-term memory. Alternatively spliced transcript variants encoding distinct isoforms have been reported. [provided by RefSeq, Mar 2009]"
C9orf50,375759,chromosome 9 open reading frame 50,
RAPGEF4,11069,Rap guanine nucleotide exchange factor 4,"Enables guanyl-nucleotide exchange factor activity. Predicted to be involved in regulation of neurotransmitter receptor localization to postsynaptic specialization membrane and regulation of postsynapse organization. Predicted to act upstream of or within adenylate cyclase-activating G protein-coupled receptor signaling pathway; regulation of exocytosis; and secretion by cell. Predicted to be located in plasma membrane. Predicted to be active in glutamatergic synapse; hippocampal mossy fiber to CA3 synapse; and postsynaptic density. Implicated in autistic disorder. [provided by Alliance of Genome Resources, Apr 2022]"
RASL10B,91608,RAS like family 10 member B,"Predicted to enable G protein activity and GTP binding activity. Predicted to be involved in positive regulation of peptide hormone secretion and regulation of systemic arterial blood pressure by atrial natriuretic peptide. Predicted to be located in plasma membrane. [provided by Alliance of Genome Resources, Apr 2022]"
SPRY4,81848,sprouty RTK signaling antagonist 4,"This gene encodes a member of a family of cysteine- and proline-rich proteins. The encoded protein is an inhibitor of the receptor-transduced mitogen-activated protein kinase (MAPK) signaling pathway. Activity of this protein impairs the formation of active GTP-RAS. Nucleotide variation in this gene has been associated with hypogonadotropic hypogonadism 17 with or without anosmia. Alternative splicing results in a multiple transcript variants. [provided by RefSeq, Jun 2014]"
NYNRIN,57523,NYN domain and retroviral integrase containing,"Predicted to enable endoribonuclease activity and mRNA binding activity. Predicted to be involved in RNA phosphodiester bond hydrolysis, endonucleolytic. Predicted to be integral component of membrane. Predicted to be active in cytoplasmic ribonucleoprotein granule and nucleus. [provided by Alliance of Genome Resources, Apr 2022]"
RAMP2-AS1,100190938,RAMP2 antisense RNA 1,
FLRT1,23769,fibronectin leucine rich transmembrane protein 1,"This gene encodes a member of the fibronectin leucine rich transmembrane protein (FLRT) family. The family members may function in cell adhesion and/or receptor signalling. Their protein structures resemble small leucine-rich proteoglycans found in the extracellular matrix. The encoded protein shares sequence similarity with two other family members, FLRT2 and FLRT3. This gene is expressed in kidney and brain. [provided by RefSeq, Jul 2008]"
SYTL5,94122,synaptotagmin like 5,"The protein encoded by this gene belongs to the synaptotagmin-like (Slp) protein family, which contains a unique homology domain at the N-terminus, referred to as the Slp homology domain (SHD). The SHD functions as a binding site for Rab27A, which plays a role in protein transport. Expression of this gene is restricted to placenta and liver, suggesting that it might be involved in Rab27A-dependent membrane trafficking in specific tissues. Alternatively spliced transcript variants encoding different isoforms have been found for this gene. [provided by RefSeq, Sep 2009]"
DSS,5376,peripheral myelin protein 22,"This gene encodes an integral membrane protein that is a major component of myelin in the peripheral nervous system. Studies suggest two alternately used promoters drive tissue-specific expression. Various mutations of this gene are causes of Charcot-Marie-Tooth disease Type IA, Dejerine-Sottas syndrome, and hereditary neuropathy with liability to pressure palsies. Alternative splicing results in multiple transcript variants. [provided by RefSeq, Jul 2013]"
ABCD2,6361,C-C motif chemokine ligand 17,"This antimicrobial gene is one of several Cys-Cys (CC) cytokine genes clustered on the q arm of chromosome 16. Cytokines are a family of secreted proteins involved in immunoregulatory and inflammatory processes. The CC cytokines are proteins characterized by two adjacent cysteines. The cytokine encoded by this gene displays chemotactic activity for T lymphocytes, but not monocytes or granulocytes. The product of this gene binds to chemokine receptors CCR4 and CCR8. This chemokine plays important roles in T cell development in thymus as well as in trafficking and activation of mature T cells. [provided by RefSeq, Sep 2014]"
HOXB9,3219,homeobox B9,"This gene is a member of the Abd-B homeobox family and encodes a protein with a homeobox DNA-binding domain. It is included in a cluster of homeobox B genes located on chromosome 17. The encoded nuclear protein functions as a sequence-specific transcription factor that is involved in cell proliferation and differentiation. Increased expression of this gene is associated with some cases of leukemia, prostate cancer and lung cancer. [provided by RefSeq, Jul 2008]"
EPB41L4B,54566,erythrocyte membrane protein band 4.1 like 4B,"Predicted to be a structural constituent of cytoskeleton. Involved in several processes, including positive regulation of cell adhesion; positive regulation of keratinocyte migration; and wound healing. Acts upstream of or within actomyosin structure organization. Located in apical part of cell; cytosol; and plasma membrane. [provided by Alliance of Genome Resources, Apr 2022]"
JPH1,56704,junctophilin 1,"Junctional complexes between the plasma membrane and endoplasmic/sarcoplasmic reticulum are a common feature of all excitable cell types and mediate cross talk between cell surface and intracellular ion channels. The protein encoded by this gene is a component of junctional complexes and is composed of a C-terminal hydrophobic segment spanning the endoplasmic/sarcoplasmic reticulum membrane and a remaining cytoplasmic domain that shows specific affinity for the plasma membrane. This gene is a member of the junctophilin gene family. [provided by RefSeq, Jul 2008]"
GUSBP5,441046,GUSB pseudogene 5,
PDZRN4,29951,PDZ domain containing ring finger 4,"Predicted to enable metal ion binding activity. [provided by Alliance of Genome Resources, Apr 2022]"
RCOR2,283248,REST corepressor 2,"Predicted to enable transcription corepressor activity. Predicted to be involved in histone deacetylation; negative regulation of transcription, DNA-templated; and regulation of transcription by RNA polymerase II. Predicted to be located in nucleus. Predicted to be part of histone deacetylase complex and transcription regulator complex. [provided by Alliance of Genome Resources, Apr 2022]"
ARC,23237,activity regulated cytoskeleton associated protein,"Predicted to enable mRNA binding activity. Involved in cell migration; cytoskeleton organization; and regulation of cell morphogenesis. Located in cytoplasm and plasma membrane. [provided by Alliance of Genome Resources, Apr 2022]"
IGFBP2,3485,insulin like growth factor binding protein 2,"The protein encoded by this gene is one of six similar proteins that bind insulin-like growth factors I and II (IGF-I and IGF-II). The encoded protein can be secreted into the bloodstream, where it binds IGF-I and IGF-II with high affinity, or it can remain intracellular, interacting with many different ligands. High expression levels of this protein promote the growth of several types of tumors and may be predictive of the chances of recovery of the patient. Several transcript variants, one encoding a secreted isoform and the others encoding nonsecreted isoforms, have been found for this gene. [provided by RefSeq, Sep 2015]"
KIAA0366,23501,KIAA0366 protein,
SLITRK6,84189,SLIT and NTRK like family member 6,"This gene encodes a member of the SLITRK protein family. Members of this family are integral membrane proteins that are characterized by two N-terminal leucine-rich repeat (LRR) domains and a C-terminal region that shares homology with trk neurotrophin receptors. This protein functions as a regulator of neurite outgrowth required for normal hearing and vision. Mutations in this gene are a cause of myopia and deafness. [provided by RefSeq, Dec 2014]"
NDRG4,65009,NDRG family member 4,"This gene is a member of the N-myc downregulated gene family which belongs to the alpha/beta hydrolase superfamily. The protein encoded by this gene is a cytoplasmic protein that is required for cell cycle progression and survival in primary astrocytes and may be involved in the regulation of mitogenic signalling in vascular smooth muscles cells. Alternative splicing results in multiple transcripts encoding different isoforms.[provided by RefSeq, Jun 2011]"
PPFIA4,8497,PTPRF interacting protein alpha 4,"PPFIA4, or liprin-alpha-4, belongs to the liprin-alpha gene family. See liprin-alpha-1 (LIP1, or PPFIA1; MIM 611054) for background on liprins.[supplied by OMIM, Mar 2008]"
RASSF10,644943,Ras association domain family member 10,"Predicted to be involved in positive regulation of neural precursor cell proliferation and positive regulation of neurogenesis. Predicted to be located in cytosol; microtubule organizing center; and spindle pole. [provided by Alliance of Genome Resources, Apr 2022]"
PHKA1,5255,phosphorylase kinase regulatory subunit alpha 1,"Phosphorylase kinase is a polymer of 16 subunits, four each of alpha, beta, gamma and delta. The alpha subunit includes the skeletal muscle and hepatic isoforms, and the skeletal muscle isoform is encoded by this gene. The beta subunit is the same in both the muscle and hepatic isoforms, and encoded by one gene. The gamma subunit also includes the skeletal muscle and hepatic isoforms, which are encoded by two different genes. The delta subunit is a calmodulin and can be encoded by three different genes. The gamma subunits contain the active site of the enzyme, whereas the alpha and beta subunits have regulatory functions controlled by phosphorylation. The delta subunit mediates the dependence of the enzyme on calcium concentration. Mutations in this gene cause glycogen storage disease type 9D, also known as X-linked muscle glycogenosis. Alternatively spliced transcript variants encoding different isoforms have been identified in this gene. A pseudogene has been found on chromosome 1.[provided by RefSeq, Feb 2010]"
HOXA6,3203,homeobox A6,"In vertebrates, the genes encoding the class of transcription factors called homeobox genes are found in clusters named A, B, C, and D on four separate chromosomes. Expression of these proteins is spatially and temporally regulated during embryonic development. This gene is part of the A cluster on chromosome 7 and encodes a DNA-binding transcription factor which may regulate gene expression, morphogenesis, and differentiation. [provided by RefSeq, Jul 2008]"
MDFI,4188,MyoD family inhibitor,"This protein is a transcription factor that negatively regulates other myogenic family proteins. Studies of the mouse homolog, I-mf, show that it interferes with myogenic factor function by masking nuclear localization signals and preventing DNA binding. Knockout mouse studies show defects in the formation of vertebrae and ribs that also involve cartilage formation in these structures. [provided by RefSeq, Jul 2008]"
EMILIN1,11117,elastin microfibril interfacer 1,"This gene encodes an extracellular matrix glycoprotein that is characterized by an N-terminal microfibril interface domain, a coiled-coiled alpha-helical domain, a collagenous domain and a C-terminal globular C1q domain. The encoded protein associates with elastic fibers at the interface between elastin and microfibrils and may play a role in the development of elastic tissues including large blood vessels, dermis, heart and lung. [provided by RefSeq, Sep 2009]"
RIMS2,9699,regulating synaptic membrane exocytosis 2,"The protein encoded by this gene is a presynaptic protein that interacts with RAB3, a protein important for normal neurotransmitter release. The encoded protein can also bind several other synaptic proteins, including UNC-13 homolog B, ELKS/Rab6-interacting/CAST family member 1, and synaptotagmin 1. This protein is involved in synaptic membrane exocytosis. Polymorphisms in this gene have been associated with degenerative lumbar scoliosis. [provided by RefSeq, Feb 2017]"
KLHL31,401265,kelch like family member 31,"Involved in negative regulation of JNK cascade and negative regulation of protein phosphorylation. Located in cytoplasm and nucleus. [provided by Alliance of Genome Resources, Apr 2022]"
EFS,10278,embryonal Fyn-associated substrate,"The protein encoded by this gene is a member of the CAS (CRK-associated substrate) family of adaptor proteins which typically serve as scaffolds for the assembly of larger signaling complexes. These complexes form at the cell surface where integrin binding leads to the subsequent phosphorylation of a CAS protein. Additional binding of SRC family kinases leads to CAS hyperphosphorylation and the creation of binding sites for CRK and other proteins that cause actin cytoskeleton reorganization. This gene plays a role in integrin-mediated cell attachment, spreading, and migration and also plays a role in both normal and malignant cellular transformation. This broadly expressed gene has been shown to play a role in neurite outgrowth and its expression in the thymus and lymphocytes is important for T cell maturation and the development of immunological self-tolerance. Alternative splicing of this gene results in multiple transcript variants encoding distinct isoforms. [provided by RefSeq, Jul 2020]"
PCDHB19P,84054,protocadherin beta 19 pseudogene,
EMID1,129080,EMI domain containing 1,"Predicted to be located in several cellular components, including Golgi apparatus; endoplasmic reticulum; and extracellular matrix. Predicted to be part of collagen trimer. [provided by Alliance of Genome Resources, Apr 2022]"
LINC00896,150197,long intergenic non-protein coding RNA 896,
SLC26A10,65012,"solute carrier family 26 member 10, pseudogene","Predicted to enable anion transmembrane transporter activity. Predicted to be involved in anion transport. Predicted to be active in basolateral plasma membrane. Predicted to be integral component of plasma membrane. [provided by Alliance of Genome Resources, Apr 2022]"
TMEM268,203197,transmembrane protein 268,"Predicted to be integral component of membrane. [provided by Alliance of Genome Resources, Apr 2022]"
HOXD10,3236,homeobox D10,"This gene is a member of the Abd-B homeobox family and encodes a protein with a homeobox DNA-binding domain. It is included in a cluster of homeobox D genes located on chromosome 2. The encoded nuclear protein functions as a sequence-specific transcription factor that is expressed in the developing limb buds and is involved in differentiation and limb development. Mutations in this gene have been associated with Wilm's tumor and congenital vertical talus (also known as ""rocker-bottom foot"" deformity or congenital convex pes valgus) and/or a foot deformity resembling that seen in Charcot-Marie-Tooth disease. [provided by RefSeq, Jul 2008]"
AGMO,392636,alkylglycerol monooxygenase,"The protein encoded by this gene is a tetrahydrobiopterin- and iron-dependent enzyme that cleaves the ether bond of alkylglycerols. Sequence comparisons distinguish this protein as forming a third, distinct class of tetrahydrobiopterin-dependent enzymes. Variations in this gene have been associated with decreased glucose-stimulated insulin response, type 2 diabetes, and susceptibility to intracranial aneurysms. [provided by RefSeq, Aug 2012]"
THBS4,7060,thrombospondin 4,"The protein encoded by this gene belongs to the thrombospondin protein family. Thrombospondin family members are adhesive glycoproteins that mediate cell-to-cell and cell-to-matrix interactions. This protein forms a pentamer and can bind to heparin and calcium. It is involved in local signaling in the developing and adult nervous system, and it contributes to spinal sensitization and neuropathic pain states. This gene is activated during the stromal response to invasive breast cancer. It may also play a role in inflammatory responses in Alzheimer's disease. Alternative splicing results in multiple transcript variants. [provided by RefSeq, Apr 2015]"
C4A,720,complement C4A (Rodgers blood group),"This gene encodes the acidic form of complement factor 4, part of the classical activation pathway. The protein is expressed as a single chain precursor which is proteolytically cleaved into a trimer of alpha, beta, and gamma chains prior to secretion. The trimer provides a surface for interaction between the antigen-antibody complex and other complement components. The alpha chain is cleaved to release C4 anaphylatoxin, an antimicrobial peptide and a mediator of local inflammation. Deficiency of this protein is associated with systemic lupus erythematosus and type I diabetes mellitus. This gene localizes to the major histocompatibility complex (MHC) class III region on chromosome 6. Varying haplotypes of this gene cluster exist, such that individuals may have 1, 2, or 3 copies of this gene. Two transcript variants encoding different isoforms have been found for this gene. [provided by RefSeq, Nov 2014]"
KCNAB2,8514,potassium voltage-gated channel subfamily A regulatory beta subunit 2,"Voltage-gated potassium (Kv) channels represent the most complex class of voltage-gated ion channels from both functional and structural standpoints. Their diverse functions include regulating neurotransmitter release, heart rate, insulin secretion, neuronal excitability, epithelial electrolyte transport, smooth muscle contraction, and cell volume. Four sequence-related potassium channel genes - shaker, shaw, shab, and shal - have been identified in Drosophila, and each has been shown to have human homolog(s). This gene encodes a member of the potassium channel, voltage-gated, shaker-related subfamily. This member is one of the beta subunits, which are auxiliary proteins associating with functional Kv-alpha subunits. This member alters functional properties of the KCNA4 gene product. Alternative splicing of this gene results in multiple transcript variants encoding distinct isoforms. [provided by RefSeq, Dec 2010]"
JAM3,83700,junctional adhesion molecule 3,"Tight junctions represent one mode of cell-to-cell adhesion in epithelial or endothelial cell sheets, forming continuous seals around cells and serving as a physical barrier to prevent solutes and water from passing freely through the paracellular space. The protein encoded by this immunoglobulin superfamily gene member is localized in the tight junctions between high endothelial cells. Unlike other proteins in this family, the this protein is unable to adhere to leukocyte cell lines and only forms weak homotypic interactions. The encoded protein is a member of the junctional adhesion molecule protein family and acts as a receptor for another member of this family. A mutation in an intron of this gene is associated with hemorrhagic destruction of the brain, subependymal calcification, and congenital cataracts. Alternative splicing results in multiple transcript variants.[provided by RefSeq, Apr 2011]"
B3GALT1,8708,"beta-1,3-galactosyltransferase 1","This gene is a member of the beta-1,3-galactosyltransferase (beta3GalT) gene family. This family encodes type II membrane-bound glycoproteins with diverse enzymatic functions using different donor substrates (UDP-galactose and UDP-N-acetylglucosamine) and different acceptor sugars (N-acetylglucosamine, galactose, N-acetylgalactosamine). The beta3GalT genes are distantly related to the Drosophila Brainiac gene and have the protein coding sequence contained in a single exon. The beta3GalT proteins also contain conserved sequences not found in the beta4GalT or alpha3GalT proteins. The carbohydrate chains synthesized by these enzymes are designated as type 1, whereas beta4GalT enzymes synthesize type 2 carbohydrate chains. The ratio of type 1:type 2 chains changes during embryogenesis. By sequence similarity, the beta3GalT genes fall into at least two groups: beta3GalT4 and 4 other beta3GalT genes (beta3GalT1-3, beta3GalT5). This gene is expressed exclusively in the brain. The encoded protein shows strict donor substrate specificity for UDP-galactose. [provided by RefSeq, Jul 2008]"
NUDT11,55190,nudix hydrolase 11,"NUDT11 belongs to a subgroup of phosphohydrolases that preferentially attack diphosphoinositol polyphosphates (Hidaka et al., 2002 [PubMed 12105228]).[supplied by OMIM, Mar 2008]"
