GENE_NAME,ID,DESCRIPTION,SUMMARY
OCA2,4948,OCA2 melanosomal transmembrane protein,"This gene encodes the human homolog of the mouse p (pink-eyed dilution) gene. The encoded protein is believed to be an integral membrane protein involved in small molecule transport, specifically tyrosine, which is a precursor to melanin synthesis. It is involved in mammalian pigmentation, where it may control skin color variation and act as a determinant of brown or blue eye color. Mutations in this gene result in type 2 oculocutaneous albinism. Alternative splicing results in multiple transcript variants. [provided by RefSeq, Jul 2014]"
OR7A5,26659,olfactory receptor family 7 subfamily A member 5,"Olfactory receptors interact with odorant molecules in the nose, to initiate a neuronal response that triggers the perception of a smell. The olfactory receptor proteins are members of a large family of G-protein-coupled receptors (GPCR) arising from single coding-exon genes. Olfactory receptors share a 7-transmembrane domain structure with many neurotransmitter and hormone receptors and are responsible for the recognition and G protein-mediated transduction of odorant signals. The olfactory receptor gene family is the largest in the genome. The nomenclature assigned to the olfactory receptor genes and proteins for this organism is independent of other organisms. [provided by RefSeq, Jul 2008]"
LINC00589,619351,long intergenic non-protein coding RNA 589,
DNAH2,146754,dynein axonemal heavy chain 2,"Dyneins are microtubule-associated motor protein complexes composed of several heavy, light, and intermediate chains. The axonemal dyneins, found in cilia and flagella, are components of the outer and inner dynein arms attached to the peripheral microtubule doublets. DNAH2 is an axonemal inner arm dynein heavy chain (Chapelin et al., 1997 [PubMed 9256245]).[supplied by OMIM, Mar 2008]"
MLNR,2862,motilin receptor,"Motilin is a 22 amino acid peptide hormone expressed throughout the gastrointestinal (GI) tract. The protein encoded by this gene is a motilin receptor which is a member of the G-protein coupled receptor 1 family. This member is a multi-pass transmembrane protein, and is an important therapeutic target for the treatment of hypomotility disorders. [provided by RefSeq, Aug 2011]"
SCRG1,11341,stimulator of chondrogenesis 1,"Scrapie-responsive gene 1 is associated with neurodegenerative changes observed in transmissible spongiform encephalopathies. It may play a role in host response to prion-associated infections. The scrapie responsive protein 1 may be partly included in the membrane or secreted by the cells due to its hydrophobic N-terminus. In addition, the encoded protein can interact with bone marrow stromal cell antigen 1 (BST1) to enhance the differentiation potentials of human mesenchymal stem cells during tissue and bone regeneration. [provided by RefSeq, Jul 2016]"
PRDM7,11105,PR/SET domain 7,"This gene encodes a member of a family of proteins that may have roles in transcription and other nuclear processes. The encoded protein contains a KRAB (Kruppel-associated box) domain -A box and a SET (Su(var)3-9, Enhancer-of-zeste, Trithorax) domain and may function as a histone methyltransferase. [provided by RefSeq, Aug 2013]"
CCDC181,57821,coiled-coil domain containing 181,"Predicted to enable microtubule binding activity. Predicted to be located in manchette and sperm flagellum. [provided by Alliance of Genome Resources, Apr 2022]"
GLRB,2743,glycine receptor beta,"This gene encodes the beta subunit of the glycine receptor, which is a pentamer composed of alpha and beta subunits. The receptor functions as a neurotransmitter-gated ion channel, which produces hyperpolarization via increased chloride conductance due to the binding of glycine to the receptor. Mutations in this gene cause startle disease, also known as hereditary hyperekplexia or congenital stiff-person syndrome, a disease characterized by muscular rigidity. Alternative splicing results in multiple transcript variants. [provided by RefSeq, Oct 2009]"
LTK,4058,leukocyte receptor tyrosine kinase,"The protein encoded by this gene is a member of the ros/insulin receptor family of tyrosine kinases. Tyrosine-specific phosphorylation of proteins is a key to the control of diverse pathways leading to cell growth and differentiation. Multiple transcript variants encoding different isoforms have been found for this gene. [provided by RefSeq, Oct 2008]"
DSG2,1829,desmoglein 2,"This gene encodes a member of the desmoglein family and cadherin cell adhesion molecule superfamily of proteins. Desmogleins are calcium-binding transmembrane glycoprotein components of desmosomes, cell-cell junctions between epithelial, myocardial, and other cell types. The encoded preproprotein is proteolytically processed to generate the mature glycoprotein. This gene is present in a gene cluster with other desmoglein gene family members on chromosome 18. Mutations in this gene have been associated with arrhythmogenic right ventricular dysplasia, familial, 10. [provided by RefSeq, Jan 2016]"
TSPY26P,128854,"testis specific protein Y-linked 26, pseudogene","Predicted to enable chromatin binding activity and histone binding activity. Predicted to be involved in nucleosome assembly. Predicted to be active in chromatin and nucleus. [provided by Alliance of Genome Resources, Apr 2022]"
LRRIQ1,84125,leucine rich repeats and IQ motif containing 1,
GDNF,2668,glial cell derived neurotrophic factor,"This gene encodes a secreted ligand of the TGF-beta (transforming growth factor-beta) superfamily of proteins. Ligands of this family bind various TGF-beta receptors leading to recruitment and activation of SMAD family transcription factors that regulate gene expression. The encoded preproprotein is proteolytically processed to generate each subunit of the disulfide-linked homodimer. The recombinant form of this protein, a highly conserved neurotrophic factor, was shown to promote the survival and differentiation of dopaminergic neurons in culture, and was able to prevent apoptosis of motor neurons induced by axotomy. This protein is a ligand for the product of the RET (rearranged during transfection) protooncogene. Mutations in this gene may be associated with Hirschsprung disease and Tourette syndrome. This gene encodes multiple protein isoforms that may undergo similar proteolytic processing. [provided by RefSeq, Aug 2016]"
MPV17L,255027,MPV17 mitochondrial inner membrane protein like,"Involved in negative regulation of hydrogen peroxide biosynthetic process; negative regulation of mitochondrial outer membrane permeabilization involved in apoptotic signaling pathway; and reactive oxygen species metabolic process. Located in peroxisome. [provided by Alliance of Genome Resources, Apr 2022]"
ABCA8,10351,ATP binding cassette subfamily A member 8,"The membrane-associated protein encoded by this gene is a member of the superfamily of ATP-binding cassette (ABC) transporters. ABC proteins transport various molecules across extra- and intracellular membranes. ABC genes are divided into seven distinct subfamilies (ABC1, MDR/TAP, MRP, ALD, OABP, GCN20, White). This protein is a member of the ABC1 subfamily. Members of the ABC1 subfamily comprise the only major ABC subfamily found exclusively in multicellular eukaryotes. The encoded protein may regulate lipid metabolism and be involved in the formation and maintenance of myelin. Alternative splicing results in multiple transcript variants. [provided by RefSeq, Jan 2014]"
MRAP2,112609,melanocortin 2 receptor accessory protein 2,"This gene encodes a protein that modulates melanocortin receptor signaling. The encoded protein has been shown to interact with all known melanocortin receptors and may regulate both receptor trafficking and activation in response to ligands. Mice lacking a functional copy of this gene exhibit severe obesity and a mutation in this gene may be associated with severe obesity in human patients. [provided by RefSeq, Oct 2016]"
ANKRD7,56311,ankyrin repeat domain 7,"Predicted to act upstream of or within blastocyst hatching. Located in centrosome and nucleoplasm. [provided by Alliance of Genome Resources, Apr 2022]"
LOC340357,,,
RPSAP52,204010,ribosomal protein SA pseudogene 52,
ACY3,91703,aminoacylase 3,"Predicted to enable aminoacylase activity. Located in extracellular exosome. [provided by Alliance of Genome Resources, Apr 2022]"
ZIC4,84107,Zic family member 4,"This gene encodes a member of the ZIC family of C2H2-type zinc finger proteins. Members of this family are important during development, and have been associated with X-linked visceral heterotaxy and holoprosencephaly type 5. This gene is closely linked to the gene encoding zinc finger protein of the cerebellum 1, a related family member on chromosome 3. Heterozygous deletion of these linked genes is involved in Dandy-Walker malformation, which is a congenital cerebellar malformation. Multiple transcript variants have been identified for this gene. [provided by RefSeq, Dec 2009]"
ZNF660,285349,zinc finger protein 660,"This gene encodes a protein that contains multiple C2H2 zinc finger domains, and is located in a cluster of zinc-finger encoding genes on chromosome 3. Naturally-occurring readthrough transcription is observed between this gene and the downstream zinc finger protein 197 gene and is represented by GeneID:110354863. [provided by RefSeq, May 2017]"
LOC100132349,100132349,similar to zinc finger protein 273,
KLHL13,90293,kelch like family member 13,"This gene encodes a BTB and kelch domain containing protein and belongs to the kelch repeat domain containing superfamily of proteins. The encoded protein functions as an adaptor protein that complexes with Cullin 3 and other proteins to form the Cullin 3-based E3 ubiquitin-protein ligase complex. This complex is necessary for proper chromosome segregation and completion of cytokinesis. Alternate splicing results in multiple transcript variants. [provided by RefSeq, Mar 2010]"
BDNF,627,brain derived neurotrophic factor,"This gene encodes a member of the nerve growth factor family of proteins. Alternative splicing results in multiple transcript variants, at least one of which encodes a preproprotein that is proteolytically processed to generate the mature protein. Binding of this protein to its cognate receptor promotes neuronal survival in the adult brain. Expression of this gene is reduced in Alzheimer's, Parkinson's, and Huntington's disease patients. This gene may play a role in the regulation of the stress response and in the biology of mood disorders. [provided by RefSeq, Nov 2015]"
FRAS1,80144,Fraser extracellular matrix complex subunit 1,"This gene encodes an extracellular matrix protein that appears to function in the regulation of epidermal-basement membrane adhesion and organogenesis during development. Mutations in this gene cause Fraser syndrome, a multisystem malformation that can include craniofacial, urogenital and respiratory system abnormalities. Alternative splicing results in multiple transcript variants. [provided by RefSeq, Oct 2009]"
GPR82,27197,G protein-coupled receptor 82,"The protein encoded by this gene is an orphan G protein-coupled receptor of unknown function. The encoded protein is a member of a family of proteins that contain seven transmembrane domains and transduce extracellular signals through heterotrimeric G proteins. [provided by RefSeq, Sep 2011]"
MSI1,4440,musashi RNA binding protein 1,"This gene encodes a protein containing two conserved tandem RNA recognition motifs. Similar proteins in other species function as RNA-binding proteins and play central roles in posttranscriptional gene regulation. Expression of this gene has been correlated with the grade of the malignancy and proliferative activity in gliomas and melanomas. A pseudogene for this gene is located on chromosome 11q13. [provided by RefSeq, Jul 2008]"
GPC4,2239,glypican 4,"Cell surface heparan sulfate proteoglycans are composed of a membrane-associated protein core substituted with a variable number of heparan sulfate chains. Members of the glypican-related integral membrane proteoglycan family (GRIPS) contain a core protein anchored to the cytoplasmic membrane via a glycosyl phosphatidylinositol linkage.  These proteins may play a role in the control of cell division and growth regulation.  The GPC4 gene is adjacent to the 3' end of GPC3 and may also play a role in Simpson-Golabi-Behmel syndrome. [provided by RefSeq, Jul 2008]"
FCAR,2204,Fc alpha receptor,"This gene is a member of the immunoglobulin gene superfamily and encodes a receptor for the Fc region of IgA. The receptor is a transmembrane glycoprotein present on the surface of myeloid lineage cells such as neutrophils, monocytes, macrophages, and eosinophils, where it mediates immunologic responses to pathogens. It interacts with IgA-opsonized targets and triggers several immunologic defense processes, including phagocytosis, antibody-dependent cell-mediated cytotoxicity, and stimulation of the release of inflammatory mediators. Multiple alternatively spliced transcript variants encoding different isoforms have been described for this gene. [provided by RefSeq, Jul 2008]"
BIK,638,BCL2 interacting killer,"The protein encoded by this gene shares a critical BH3 domain with other death-promoting proteins, such as BID, BAK, BAD and BAX, that is required for its pro-apoptotic activity, and for interaction with anti-apoptotic members of the BCL2 family, and viral survival-promoting proteins. Since the activity of this protein is suppressed in the presence of survival-promoting proteins, it is suggested as a likely target for anti-apoptotic proteins. [provided by RefSeq, Sep 2011]"
HOTAIR,100124700,HOX transcript antisense RNA,"This gene is located within the Homeobox C (HOXC) gene cluster on chromosome 12 and is co-expressed with the HOXC genes. It functions through an RNA product, which binds lysine specific demethylase 1 (LSD1) and Polycomb repressive complex 2 (PRC2), and serves as a scaffold to assemble these regulators at the HOXD gene cluster, thereby promoting epigenetic repression of HOXD. This gene is highly expressed in multiple tumors. Alternatively spliced transcript variants have been identified. [provided by RefSeq, Feb 2019]"
ANKRD45,339416,ankyrin repeat domain 45,
MIR100HG,399959,mir-100-let-7a-2-mir-125b-1 cluster host gene,"This gene produces long non-coding RNAs that act as regulators of cell proliferation. Alternative promoter usage and splicing results in multiple transcript variants. Some transcript variants may promote growth, while others may act to negatively regulate cell division. [provided by RefSeq, May 2016]"
POU3F1,5453,POU class 3 homeobox 1,"Enables sequence-specific double-stranded DNA binding activity. Predicted to be involved in negative regulation of transcription by RNA polymerase II; positive regulation of gene expression; and positive regulation of transcription, DNA-templated. Predicted to act upstream of or within keratinocyte differentiation; nervous system development; and positive regulation of transcription by RNA polymerase II. Located in nucleoplasm. [provided by Alliance of Genome Resources, Apr 2022]"
PCDHB16,57717,protocadherin beta 16,"This gene is a member of the protocadherin beta gene cluster, one of three related gene clusters tandemly linked on chromosome five. The gene clusters demonstrate an unusual genomic organization similar to that of B-cell and T-cell receptor gene clusters. The beta cluster contains 16 genes and 3 pseudogenes, each encoding 6 extracellular cadherin domains and a cytoplasmic tail that deviates from others in the cadherin superfamily. The extracellular domains interact in a homophilic manner to specify differential cell-cell connections. Unlike the alpha and gamma clusters, the transcripts from these genes are made up of only one large exon, not sharing common 3' exons as expected. These neural cadherin-like cell adhesion proteins are integral plasma membrane proteins. Their specific functions are unknown but they most likely play a critical role in the establishment and function of specific cell-cell neural connections. [provided by RefSeq, Jul 2008]"
ZFHX4,79776,zinc finger homeobox 4,"Predicted to enable DNA-binding transcription factor activity, RNA polymerase II-specific and RNA polymerase II cis-regulatory region sequence-specific DNA binding activity. Predicted to be involved in regulation of transcription by RNA polymerase II. Predicted to be part of chromatin. Predicted to be active in nucleus. [provided by Alliance of Genome Resources, Apr 2022]"
DFNA13,1302,collagen type XI alpha 2 chain,"This gene encodes one of the two alpha chains of type XI collagen, a minor fibrillar collagen. It is located on chromosome 6 very close to but separate from the gene for retinoid X receptor beta. Type XI collagen is a heterotrimer but the third alpha chain is a post-translationally modified alpha 1 type II chain. Proteolytic processing of this type XI chain produces PARP, a proline/arginine-rich protein that is an amino terminal domain. Mutations in this gene are associated with type III Stickler syndrome, otospondylomegaepiphyseal dysplasia (OSMED syndrome), Weissenbacher-Zweymuller syndrome, autosomal dominant non-syndromic sensorineural type 13 deafness (DFNA13), and autosomal recessive non-syndromic sensorineural type 53 deafness (DFNB53). Alternative splicing results in multiple transcript variants. A related pseudogene is located nearby on chromosome 6. [provided by RefSeq, Jul 2009]"
FLRT3,23767,fibronectin leucine rich transmembrane protein 3,"This gene encodes a member of the fibronectin leucine rich transmembrane protein (FLRT) family. FLRTs may function in cell adhesion and/or receptor signalling. Their protein structures resemble small leucine-rich proteoglycans found in the extracellular matrix. This gene is expressed in many tissues. Two alternatively spliced transcript variants encoding the same protein have been described for this gene. [provided by RefSeq, Jul 2010]"
DZIP1,22873,DAZ interacting zinc finger protein 1,"Predicted to enable metal ion binding activity. Involved in cilium assembly; germ cell development; and spermatogenesis. Located in cytosol; microtubule organizing center; and nucleoplasm. Colocalizes with centriole. Implicated in mitral valve prolapse and spermatogenic failure 47. [provided by Alliance of Genome Resources, Apr 2022]"
SERTAD4,56256,SERTA domain containing 4,"Predicted to be located in nucleus. [provided by Alliance of Genome Resources, Apr 2022]"
HOXA13,3209,homeobox A13,"In vertebrates, the genes encoding the class of transcription factors called homeobox genes are found in clusters named A, B, C, and D on four separate chromosomes. Expression of these proteins is spatially and temporally regulated during embryonic development. This gene is part of the A cluster on chromosome 7 and encodes a DNA-binding transcription factor which may regulate gene expression, morphogenesis, and differentiation. Expansion of a polyalanine tract in the encoded protein can cause hand-foot-uterus syndrome, also known as hand-foot-genital syndrome. [provided by RefSeq, Jul 2008]"
C9orf50,375759,chromosome 9 open reading frame 50,
TRPM3,80036,transient receptor potential cation channel subfamily M member 3,"The product of this gene belongs to the family of transient receptor potential (TRP) channels. TRP channels are cation-selective channels important for cellular calcium signaling and homeostasis. The protein encoded by this gene mediates calcium entry, and this entry is potentiated by calcium store depletion. Alternatively spliced transcript variants encoding different isoforms have been identified. [provided by RefSeq, Jul 2008]"
DNAJC12,56521,DnaJ heat shock protein family (Hsp40) member C12,"This gene encodes a member of a subclass of the HSP40/DnaJ protein family. Members of this family of proteins are associated with complex assembly, protein folding, and export. Two transcript variants encoding distinct isoforms have been identified for this gene. [provided by RefSeq, Jul 2008]"
SUCNR1,56670,succinate receptor 1,"This gene encodes a G-protein-coupled receptor for succinate, an intermediate molecule of the citric acid cycle. It is involved in the promotion of hematopoietic progenitor cell development, and it has a potential role in renovascular hypertension which has known correlations to renal failure, diabetes and atherosclerosis. [provided by RefSeq, Oct 2009]"
ZNF521,25925,zinc finger protein 521,"Enables protein domain specific binding activity. Predicted to be involved in regulation of transcription by RNA polymerase II. Predicted to act upstream of or within neuron fate commitment. Located in nucleus. [provided by Alliance of Genome Resources, Apr 2022]"
ZNF883,169834,zinc finger protein 883,"Predicted to enable DNA-binding transcription factor activity, RNA polymerase II-specific and RNA polymerase II cis-regulatory region sequence-specific DNA binding activity. Predicted to be involved in regulation of transcription by RNA polymerase II. Predicted to be located in nucleus. [provided by Alliance of Genome Resources, Apr 2022]"
CCDC74B,91409,coiled-coil domain containing 74B,
KCNAB2,8514,potassium voltage-gated channel subfamily A regulatory beta subunit 2,"Voltage-gated potassium (Kv) channels represent the most complex class of voltage-gated ion channels from both functional and structural standpoints. Their diverse functions include regulating neurotransmitter release, heart rate, insulin secretion, neuronal excitability, epithelial electrolyte transport, smooth muscle contraction, and cell volume. Four sequence-related potassium channel genes - shaker, shaw, shab, and shal - have been identified in Drosophila, and each has been shown to have human homolog(s). This gene encodes a member of the potassium channel, voltage-gated, shaker-related subfamily. This member is one of the beta subunits, which are auxiliary proteins associating with functional Kv-alpha subunits. This member alters functional properties of the KCNA4 gene product. Alternative splicing of this gene results in multiple transcript variants encoding distinct isoforms. [provided by RefSeq, Dec 2010]"
DSS,5376,peripheral myelin protein 22,"This gene encodes an integral membrane protein that is a major component of myelin in the peripheral nervous system. Studies suggest two alternately used promoters drive tissue-specific expression. Various mutations of this gene are causes of Charcot-Marie-Tooth disease Type IA, Dejerine-Sottas syndrome, and hereditary neuropathy with liability to pressure palsies. Alternative splicing results in multiple transcript variants. [provided by RefSeq, Jul 2013]"
PIEZO2,63895,piezo type mechanosensitive ion channel component 2,"The protein encoded by this gene contains more than thirty transmembrane domains and likely functions as part of mechanically-activated (MA) cation channels. These channels serve to connect mechanical forces to biological signals. The encoded protein quickly adapts MA currents in somatosensory neurons. Defects in this gene are a cause of type 5 distal arthrogryposis. Several alternatively spliced transcript variants of this gene have been described, but their full-length nature is not known. [provided by RefSeq, Feb 2014]"
C1GALT1C1L,728819,C1GALT1 specific chaperone 1 like,"Predicted to enable glycoprotein-N-acetylgalactosamine 3-beta-galactosyltransferase activity. Predicted to be involved in O-glycan processing, core 1. Predicted to be integral component of membrane. [provided by Alliance of Genome Resources, Apr 2022]"
RGS18,64407,regulator of G protein signaling 18,"This gene encodes a member of the regulator of G-protein signaling family. This protein is contains a conserved, 120 amino acid motif called the RGS domain. The protein attenuates the signaling activity of G-proteins by binding to activated, GTP-bound G alpha subunits and acting as a GTPase activating protein (GAP), increasing the rate of conversion of the GTP to GDP. This hydrolysis allows the G alpha subunits to bind G beta/gamma subunit heterodimers, forming inactive G-protein heterotrimers, thereby terminating the signal. Alternate transcriptional splice variants of this gene have been observed but have not been thoroughly characterized. [provided by RefSeq, Jul 2008]"
UBE2Q2P3,100134869,UBE2Q2 pseudogene 2,
SLITRK6,84189,SLIT and NTRK like family member 6,"This gene encodes a member of the SLITRK protein family. Members of this family are integral membrane proteins that are characterized by two N-terminal leucine-rich repeat (LRR) domains and a C-terminal region that shares homology with trk neurotrophin receptors. This protein functions as a regulator of neurite outgrowth required for normal hearing and vision. Mutations in this gene are a cause of myopia and deafness. [provided by RefSeq, Dec 2014]"
MMP16,4325,matrix metallopeptidase 16,"Proteins of the matrix metalloproteinase (MMP) family are involved in the breakdown of extracellular matrix in normal physiological processes, such as embryonic development, reproduction, and tissue remodeling, as well as in disease processes, such as arthritis and metastasis. Most MMP's are secreted as inactive proproteins which are activated when cleaved by extracellular proteinases. The encoded protein activates MMP2 by cleavage. This gene was once referred to as MT-MMP2, but was renamed as MT-MMP3 or MMP16. [provided by RefSeq, Oct 2010]"
